{
  "preferred_arch": "arm64-v8a",
  "auto_update_urls": true,
  "patch_repos": {
    "com.google.android.youtube": {
      "name": "youtube",
      "repo": "MorpheApp/morphe-patches",
      "branch": "dev",
      "apkmirror_path": "google-inc/youtube",
      "display_name": "YouTube"
    },
    "com.google.android.apps.youtube.music": {
      "name": "ytmusic",
      "repo": "MorpheApp/morphe-patches",
      "branch": "main",
      "apkmirror_path": "google-inc/youtube-music",
      "display_name": "YouTube Music"
    },
    "com.reddit.frontpage": {
      "name": "reddit",
      "repo": "MorpheApp/morphe-patches",
      "branch": "main",
      "apkmirror_path": "redditinc/reddit",
      "display_name": "Reddit"
    },
    "com.sofascore.results": {
      "name": "sofascore",
      "repo": "hoo-dles/morphe-patches",
      "branch": "main",
      "apkmirror_path": "sofascore/soccer-scores-and-sports-livescore-sofascore",
      "display_name": "Sofascore"
    },
    "tv.twitch.android.app": {
      "name": "twitch",
      "repo": "RookieEnough/De-Vanced",
      "branch": "main",
      "apkmirror_path": "twitch-interactive-inc/twitch-live-streaming",
      "display_name": "Twitch"
    },
    "com.kevinforeman.nzb360": {
      "name": "nzb360",
      "repo": "rushiranpise/morphe-patches",
      "branch": "main",
      "apkmirror_path": "kevin-foreman/nzb360",
      "pin_patch_tag": "v1.18.3",
      "display_name": "NZB360"
    },
    "com.flightradar24free": {
      "name": "flightradar24",
      "repo": "rushiranpise/morphe-patches",
      "branch": "main",
      "apkmirror_path": "flightradar24-ab/flightradar24-flight-tracker-2",
      "display_name": "Flightradar24"
    }
  },
  "cli": {
    "repo": "MorpheApp/morphe-desktop",
    "branch": "main"
  },
  "download_urls": {}
}
